{
  "$schema": "./components.schema.json",
  "meta": {
    "schemaVersion": "1.0.0",
    "generatedAt": "1970-01-01T00:00:00.000Z",
    "project": "Editora",
    "website": "https://editora-ecosystem.netlify.app/",
    "storybook": "https://editora-ecosystem-storybook.netlify.app/",
    "docs": "https://editora-ecosystem.netlify.app/docs/intro",
    "status": "initial",
    "notes": [
      "This registry is intended for AI assistants and developer tooling.",
      "Storybook paths are normalized guesses for quick lookup; verify exact story IDs when needed.",
      "Use package exports as the source of truth for runtime integration."
    ]
  },
  "packageDocs": {
    "@editora/core": "https://editora-ecosystem.netlify.app/docs/editor/core",
    "@editora/react": "https://editora-ecosystem.netlify.app/docs/editor/react",
    "@editora/plugins": "https://editora-ecosystem.netlify.app/docs/editor/plugins",
    "@editora/themes": "https://editora-ecosystem.netlify.app/docs/editor/themes",
    "@editora/ui-core": "https://editora-ecosystem.netlify.app/docs/ui-core",
    "@editora/ui-react": "https://editora-ecosystem.netlify.app/docs/ui-react",
    "@editora/icons": "https://editora-ecosystem.netlify.app/docs/icons",
    "@editora/react-icons": "https://editora-ecosystem.netlify.app/docs/react-icons",
    "@editora/toast": "https://editora-ecosystem.netlify.app/docs/toast"
  },
  "aiDefaults": {
    "requiredImports": [
      "@editora/ui-react",
      "@editora/react-icons",
      "@editora/toast"
    ],
    "componentPriority": [
      "ui-core for framework-agnostic primitives",
      "ui-react only as wrappers"
    ],
    "codeStyle": [
      "use real package imports",
      "avoid placeholder components",
      "prefer runnable snippets"
    ]
  },
  "components": [
    {
      "id": "ui-core:ui-accordion",
      "package": "@editora/ui-core",
      "framework": "web-component",
      "name": "accordion",
      "tagName": "ui-accordion",
      "source": "packages/ui-core/src/components/ui-accordion.ts",
      "docsPath": "/docs/ui-core",
      "storybookPath": "/story/ui-accordion--playground",
      "styleApi": {
        "cssVars": true,
        "parts": true,
        "states": [
          "disabled",
          "invalid",
          "open",
          "active"
        ]
      }
    },
    {
      "id": "ui-core:ui-alert-dialog",
      "package": "@editora/ui-core",
      "framework": "web-component",
      "name": "alert-dialog",
      "tagName": "ui-alert-dialog",
      "source": "packages/ui-core/src/components/ui-alert-dialog.ts",
      "docsPath": "/docs/ui-core",
      "storybookPath": "/story/ui-alert-dialog--playground",
      "styleApi": {
        "cssVars": true,
        "parts": true,
        "states": [
          "disabled",
          "invalid",
          "open",
          "active"
        ]
      }
    },
    {
      "id": "ui-core:ui-alert",
      "package": "@editora/ui-core",
      "framework": "web-component",
      "name": "alert",
      "tagName": "ui-alert",
      "source": "packages/ui-core/src/components/ui-alert.ts",
      "docsPath": "/docs/ui-core",
      "storybookPath": "/story/ui-alert--playground",
      "styleApi": {
        "cssVars": true,
        "parts": true,
        "states": [
          "disabled",
          "invalid",
          "open",
          "active"
        ]
      }
    },
    {
      "id": "ui-core:ui-app-header",
      "package": "@editora/ui-core",
      "framework": "web-component",
      "name": "app-header",
      "tagName": "ui-app-header",
      "source": "packages/ui-core/src/components/ui-app-header.ts",
      "docsPath": "/docs/ui-core",
      "storybookPath": "/story/ui-app-header--playground",
      "styleApi": {
        "cssVars": true,
        "parts": true,
        "states": [
          "disabled",
          "invalid",
          "open",
          "active"
        ]
      }
    },
    {
      "id": "ui-core:ui-aspect-ratio",
      "package": "@editora/ui-core",
      "framework": "web-component",
      "name": "aspect-ratio",
      "tagName": "ui-aspect-ratio",
      "source": "packages/ui-core/src/components/ui-aspect-ratio.ts",
      "docsPath": "/docs/ui-core",
      "storybookPath": "/story/ui-aspect-ratio--playground",
      "styleApi": {
        "cssVars": true,
        "parts": true,
        "states": [
          "disabled",
          "invalid",
          "open",
          "active"
        ]
      }
    },
    {
      "id": "ui-core:ui-avatar",
      "package": "@editora/ui-core",
      "framework": "web-component",
      "name": "avatar",
      "tagName": "ui-avatar",
      "source": "packages/ui-core/src/components/ui-avatar.ts",
      "docsPath": "/docs/ui-core",
      "storybookPath": "/story/ui-avatar--playground",
      "styleApi": {
        "cssVars": true,
        "parts": true,
        "states": [
          "disabled",
          "invalid",
          "open",
          "active"
        ]
      }
    },
    {
      "id": "ui-core:ui-badge",
      "package": "@editora/ui-core",
      "framework": "web-component",
      "name": "badge",
      "tagName": "ui-badge",
      "source": "packages/ui-core/src/components/ui-badge.ts",
      "docsPath": "/docs/ui-core",
      "storybookPath": "/story/ui-badge--playground",
      "styleApi": {
        "cssVars": true,
        "parts": true,
        "states": [
          "disabled",
          "invalid",
          "open",
          "active"
        ]
      }
    },
    {
      "id": "ui-core:ui-block-controls",
      "package": "@editora/ui-core",
      "framework": "web-component",
      "name": "block-controls",
      "tagName": "ui-block-controls",
      "source": "packages/ui-core/src/components/ui-block-controls.ts",
      "docsPath": "/docs/ui-core",
      "storybookPath": "/story/ui-block-controls--playground",
      "styleApi": {
        "cssVars": true,
        "parts": true,
        "states": [
          "disabled",
          "invalid",
          "open",
          "active"
        ]
      }
    },
    {
      "id": "ui-core:ui-box",
      "package": "@editora/ui-core",
      "framework": "web-component",
      "name": "box",
      "tagName": "ui-box",
      "source": "packages/ui-core/src/components/ui-box.ts",
      "docsPath": "/docs/ui-core",
      "storybookPath": "/story/ui-box--playground",
      "styleApi": {
        "cssVars": true,
        "parts": true,
        "states": [
          "disabled",
          "invalid",
          "open",
          "active"
        ]
      }
    },
    {
      "id": "ui-core:ui-breadcrumb",
      "package": "@editora/ui-core",
      "framework": "web-component",
      "name": "breadcrumb",
      "tagName": "ui-breadcrumb",
      "source": "packages/ui-core/src/components/ui-breadcrumb.ts",
      "docsPath": "/docs/ui-core",
      "storybookPath": "/story/ui-breadcrumb--playground",
      "styleApi": {
        "cssVars": true,
        "parts": true,
        "states": [
          "disabled",
          "invalid",
          "open",
          "active"
        ]
      }
    },
    {
      "id": "ui-core:ui-button",
      "package": "@editora/ui-core",
      "framework": "web-component",
      "name": "button",
      "tagName": "ui-button",
      "source": "packages/ui-core/src/components/ui-button.ts",
      "docsPath": "/docs/ui-core",
      "storybookPath": "/story/ui-button--playground",
      "styleApi": {
        "cssVars": true,
        "parts": true,
        "states": [
          "disabled",
          "invalid",
          "open",
          "active"
        ]
      }
    },
    {
      "id": "ui-core:ui-calendar",
      "package": "@editora/ui-core",
      "framework": "web-component",
      "name": "calendar",
      "tagName": "ui-calendar",
      "source": "packages/ui-core/src/components/ui-calendar.ts",
      "docsPath": "/docs/ui-core",
      "storybookPath": "/story/ui-calendar--playground",
      "styleApi": {
        "cssVars": true,
        "parts": true,
        "states": [
          "disabled",
          "invalid",
          "open",
          "active"
        ]
      }
    },
    {
      "id": "ui-core:ui-chart",
      "package": "@editora/ui-core",
      "framework": "web-component",
      "name": "chart",
      "tagName": "ui-chart",
      "source": "packages/ui-core/src/components/ui-chart.ts",
      "docsPath": "/docs/ui-core",
      "storybookPath": "/story/ui-chart--playground",
      "styleApi": {
        "cssVars": true,
        "parts": true,
        "states": [
          "disabled",
          "invalid",
          "open",
          "active"
        ]
      }
    },
    {
      "id": "ui-core:ui-checkbox",
      "package": "@editora/ui-core",
      "framework": "web-component",
      "name": "checkbox",
      "tagName": "ui-checkbox",
      "source": "packages/ui-core/src/components/ui-checkbox.ts",
      "docsPath": "/docs/ui-core",
      "storybookPath": "/story/ui-checkbox--playground",
      "styleApi": {
        "cssVars": true,
        "parts": true,
        "states": [
          "disabled",
          "invalid",
          "open",
          "active"
        ]
      }
    },
    {
      "id": "ui-core:ui-collapsible",
      "package": "@editora/ui-core",
      "framework": "web-component",
      "name": "collapsible",
      "tagName": "ui-collapsible",
      "source": "packages/ui-core/src/components/ui-collapsible.ts",
      "docsPath": "/docs/ui-core",
      "storybookPath": "/story/ui-collapsible--playground",
      "styleApi": {
        "cssVars": true,
        "parts": true,
        "states": [
          "disabled",
          "invalid",
          "open",
          "active"
        ]
      }
    },
    {
      "id": "ui-core:ui-color-picker",
      "package": "@editora/ui-core",
      "framework": "web-component",
      "name": "color-picker",
      "tagName": "ui-color-picker",
      "source": "packages/ui-core/src/components/ui-color-picker.ts",
      "docsPath": "/docs/ui-core",